id,created_utc,author,stickied,score,url,num_comments,spoiler,edited,over_18,title
1e3y2re,2024-07-15 15:46:01,bancaletto,False,90,https://www.reddit.com/r/dataengineering/comments/1e3y2re/your_dream_data_architecture/,61,False,False,False,Your dream data Architecture
1e45med,2024-07-15 20:42:11,ivanovyordan,False,71,https://i.redd.it/tcmqddevuqcd1.jpeg,14,False,False,False,How often do stakeholders think they are special?
1e3n522,2024-07-15 05:40:00,GreymanTheGrey,False,39,https://www.reddit.com/r/dataengineering/comments/1e3n522/economical_data_warehouse_based_on_parquet_in_gcp/,26,False,False,False,Economical data warehouse based on Parquet in GCP Storage
1e4686z,2024-07-15 21:05:57,citizenofacceptance2,False,23,https://www.reddit.com/r/dataengineering/comments/1e4686z/anyone_work_a_government_job_in_the_us_as_a_de/,4,False,False,False,Anyone work a government job in the US as a DE?
1e47pij,2024-07-15 22:05:47,pm_me_data_wisdom,False,18,https://www.reddit.com/r/dataengineering/comments/1e47pij/with_zero_experience_whats_fair_entrylevel_pay/,36,False,False,False,"With zero experience, what's fair entry-level pay?"
1e3mw63,2024-07-15 05:24:48,ephemeral404,False,13,https://i.redd.it/m1fphhfabmcd1.png,0,False,False,False,Building a real-time personalization engine
1e4d6sn,2024-07-16 02:17:25,Fraiz24,False,14,https://www.reddit.com/gallery/1e4d6sn,0,False,False,False,1st app. Golf score tracker
1e3u406,2024-07-15 12:56:01,Front_Veterinarian53,False,12,https://www.reddit.com/r/dataengineering/comments/1e3u406/cloud_warehouse_bills/,13,False,False,False,Cloud warehouse bills
1e3nt51,2024-07-15 06:22:43,Bright_Bunch_7208,False,11,https://www.reddit.com/r/dataengineering/comments/1e3nt51/would_you_use_a_data_engineer_focused_copilot/,37,False,False,False,Would you use a Data Engineer focused CoPilot?
1e415ze,2024-07-15 17:47:21,Far-Mixture-2254,False,8,https://www.reddit.com/r/dataengineering/comments/1e415ze/new_to_databricks_and_snowflakes/,4,False,False,False,New to databricks and snowflakes
1e47x6x,2024-07-15 22:14:47,Icy_Clench,False,6,https://www.reddit.com/r/dataengineering/comments/1e47x6x/what_are_your_de_horror_stories_and_feats/,9,False,False,False,What are your DE horror stories and feats?
1e42iqn,2024-07-15 18:41:07,ExploAnalytics,False,6,https://www.reddit.com/r/dataengineering/comments/1e42iqn/free_sample_data_generator/,4,False,False,False,Free Sample Data Generator
1e3uc5v,2024-07-15 13:06:38,growth_man,False,4,https://moderndata101.substack.com/p/tearing-down-monolith-the-rise-of-microservices,1,False,False,False,Tearing Down the Monolith | The Rise of Microservices & Modular Architecture in Data Engineering
1e3q21m,2024-07-15 08:55:22,DifficultyNo3182,False,4,https://www.reddit.com/r/dataengineering/comments/1e3q21m/designing_platform_logging_pipeline/,4,False,False,False,Designing Platform Logging Pipeline
1e3qc87,2024-07-15 09:14:19,Free-Way-5831,False,3,https://www.reddit.com/r/dataengineering/comments/1e3qc87/glue_visual_studio_help/,2,False,False,False,Glue Visual Studio Help
1e48tyn,2024-07-15 22:53:50,letsgopablo,False,2,https://www.reddit.com/r/dataengineering/comments/1e48tyn/data_fabric_vs_data_warehouse/,0,False,False,False,Data Fabric vs Data Warehouse
1e47wv7,2024-07-15 22:14:23,howtorewriteaname,False,2,https://www.reddit.com/r/dataengineering/comments/1e47wv7/resources_to_quickly_grasp_gcp_and_sqlmlops/,2,False,False,False,Resources to quickly grasp GCP and SQL/MLOps knowledge coming from ML research and Data Scientist position
1e4717d,2024-07-15 21:38:07,chongsurfer,False,2,https://www.reddit.com/r/dataengineering/comments/1e4717d/de_junior_responsible_for_implement_all_microsoft/,3,False,False,False,DE Junior responsible for implement all Microsoft Fabric enviroment
1e45swt,2024-07-15 20:49:25,dr_danthebandageman,False,2,https://www.reddit.com/r/dataengineering/comments/1e45swt/seeking_advice_partner_companies_vs_inhouse/,3,False,False,False,Seeking Advice: Partner Companies vs. In-House Development for a Sensor-Based Data Collection System
1e457gw,2024-07-15 20:25:43,RaisinAccurate1278,False,2,https://www.reddit.com/r/dataengineering/comments/1e457gw/databricks_uc_dlt_confusion/,2,False,False,False,Databricks UC / DLT - Confusion....
1e430af,2024-07-15 19:00:34,feelosophy13,False,2,https://www.reddit.com/r/dataengineering/comments/1e430af/mysqltosnowflake_and_postgresqltosnowflake_native/,1,False,False,False,MySQL-to-Snowflake and PostgreSQL-to-Snowflake native connectors!
1e3wz5i,2024-07-15 15:02:02,kingabzpro,False,2,https://www.datacamp.com/blog/airflow-alternatives,1,False,False,False,Top 5 Airflow Alternatives for Data Orchestration (Code Examples Included)
1e4e6b1,2024-07-16 03:06:18,ephemeral404,False,2,https://www.reddit.com/r/dataengineering/comments/1e4e6b1/what_is_id_stitching_and_why_is_it_hard/,3,False,False,False,What is id stitching and why is it hard
1e4dgmg,2024-07-16 02:31:09,Lurch1400,False,1,https://www.reddit.com/r/dataengineering/comments/1e4dgmg/linked_servers/,2,False,False,False,Linked Servers
1e49e8d,2024-07-15 23:18:25,igz16,False,1,https://www.reddit.com/r/dataengineering/comments/1e49e8d/data_analyst_or_not_understanding_your_market/,0,False,False,False,Data Analyst or Not: Understanding Your Market Research Role
1e46lta,2024-07-15 21:21:08,Sea-Forever3053,False,1,https://www.reddit.com/r/dataengineering/comments/1e46lta/snowflake_table_to_postgres/,1,False,False,False,snowflake table to postgres
1e46j3c,2024-07-15 21:18:10,SensitiveCucumber0,False,1,https://www.reddit.com/r/dataengineering/comments/1e46j3c/seeking_advice_in_data_engineer_carreer/,0,False,False,False,Seeking advice in data engineer carreer
1e420vl,2024-07-15 18:21:30,photon223,False,1,https://www.reddit.com/r/dataengineering/comments/1e420vl/stuck_with_legacy_data_tech/,2,False,False,False,Stuck with legacy data tech
1e3walc,2024-07-15 14:33:35,LlosgiTaiBraf,False,1,https://www.reddit.com/r/dataengineering/comments/1e3walc/would_it_make_sense_to_use_these_tools_in_this/,6,False,False,False,Would it make sense to use these tools in this context? 
1e3wlbk,2024-07-15 14:46:22,Datafluent,False,0,https://www.reddit.com/r/dataengineering/comments/1e3wlbk/python_udfs_in_snowflake/,0,False,False,False,Python UDFs in Snowflake
1e42o3l,2024-07-15 18:47:02,Far-Mixture-2254,False,0,https://www.reddit.com/r/dataengineering/comments/1e42o3l/real_time_monitoring_dashboard/,11,False,False,False,Real time Monitoring dashboard 🚀
